{
  "id_decisao": "DEC-102",
  "data": "2026-08-15",
  "decisao": "Fixture de teste — decisão resolvida sem aprovador válido",
  "alternativas": ["opção A", "opção B"],
  "escolha": "opção A",
  "justificativa": "justificativa de teste",
  "fonte": ["REF:teste"],
  "impacto": null,
  "riscos": [],
  "aprovador": "PENDENTE",
  "estado": "RESOLVIDA",
  "evidencia": { "repository_evidence": { "action_ref": "AC-001" } }
}
